InvoiceNo,StockCode,Description,Quantity,InvoiceDate,UnitPrice,CustomerID,Country
574343,22683,FRENCH BLUE METAL DOOR SIGN 8,10,2011-11-04 10:11:00,1.25,12576,Poland
574343,84970L,SINGLE HEART ZINC T-LIGHT HOLDER,12,2011-11-04 10:11:00,1.25,12576,Poland
574343,23144,ZINC T-LIGHT HOLDER STARS SMALL,12,2011-11-04 10:11:00,0.83,12576,Poland
574343,22469,HEART OF WICKER SMALL,12,2011-11-04 10:11:00,1.65,12576,Poland
574343,82583,HOT BATHS METAL SIGN,12,2011-11-04 10:11:00,2.1,12576,Poland
574343,82580,BATHROOM METAL SIGN,12,2011-11-04 10:11:00,0.55,12576,Poland
574343,23250,VINTAGE RED TRIM ENAMEL BOWL ,12,2011-11-04 10:11:00,1.25,12576,Poland
574343,23249,VINTAGE RED ENAMEL TRIM PLATE,12,2011-11-04 10:11:00,1.65,12576,Poland
574343,85054,FRENCH ENAMEL POT W LID,6,2011-11-04 10:11:00,2.95,12576,Poland
574343,85053,FRENCH ENAMEL CANDLEHOLDER,6,2011-11-04 10:11:00,2.1,12576,Poland
574343,22340,NOEL GARLAND PAINTED ZINC ,24,2011-11-04 10:11:00,0.39,12576,Poland
574343,35953,FOLKART STAR CHRISTMAS DECORATIONS,48,2011-11-04 10:11:00,0.39,12576,Poland
574343,21261,GREEN GOOSE FEATHER CHRISTMAS TREE ,6,2011-11-04 10:11:00,2.95,12576,Poland
574343,23188,VINTAGE  2 METRE FOLDING RULER,12,2011-11-04 10:11:00,1.65,12576,Poland
574343,84832,ZINC WILLIE WINKIE  CANDLE STICK,12,2011-11-04 10:11:00,0.85,12576,Poland
574343,22998,TRAVEL CARD WALLET KEEP CALM,24,2011-11-04 10:11:00,0.42,12576,Poland
574343,23394,POSTE FRANCE CUSHION COVER,4,2011-11-04 10:11:00,3.75,12576,Poland
574343,23395,BELLE JARDINIERE CUSHION COVER,4,2011-11-04 10:11:00,3.75,12576,Poland
574343,23396,LE JARDIN BOTANIQUE CUSHION COVER,4,2011-11-04 10:11:00,3.75,12576,Poland
574343,23393,HOME SWEET HOME CUSHION COVER ,4,2011-11-04 10:11:00,3.75,12576,Poland
574343,22481,BLACK TEA TOWEL CLASSIC DESIGN,12,2011-11-04 10:11:00,1.25,12576,Poland
574343,16016,LARGE CHINESE STYLE SCISSOR,10,2011-11-04 10:11:00,0.85,12576,Poland
C577395,37447,CERAMIC CAKE DESIGN SPOTTED PLATE,-4,2011-11-18 17:10:00,1.49,12779,Poland
C577395,23423,PANTRY 3 HOOK ROLLING PIN HANGER,-2,2011-11-18 17:10:00,3.75,12779,Poland
C577395,22666,RECIPE BOX PANTRY YELLOW DESIGN,-2,2011-11-18 17:10:00,2.95,12779,Poland
