,NA
1,BOX OF 9 PEBBLE CANDLES,TUMBLER, BAROQUE,SILVER STANDING GNOME   ,ASSORTED COLOUR BIRD ORNAMENT,COLOUR GLASS T-LIGHT HOLDER HANGING,BLACK CANDELABRA T-LIGHT HOLDER,HANGING JAM JAR T-LIGHT HOLDER,PAINTED METAL PEARS ASSORTED,VINTAGE UNION JACK CUSHION COVER,MOROCCAN TEA GLASS
2,RETRO COFFEE MUGS ASSORTED
3,PACK OF 60 SPACEBOY CAKE CASES,60 CAKE CASES DOLLY GIRL DESIGN,APRON APPLE DELIGHT,BULL DOG BOTTLE OPENER,SET/3 DECOUPAGE STACKING TINS,BLACK KITCHEN SCALES,CHILDS BREAKFAST SET DOLLY GIRL ,CHILDS BREAKFAST SET SPACEBOY ,SET OF 5 LUCKY CAT MAGNETS ,TV DINNER TRAY DOLLY GIRL,TV DINNER TRAY AIR HOSTESS ,SPACEBOY TV DINNER TRAY,SET 12 KIDS COLOUR  CHALK STICKS,SET 12 KIDS  WHITE CHALK STICKS,REVOLVER WOODEN RULER ,WOODEN SCHOOL COLOURING SET,COLOURING PENCILS BROWN TUBE,COLOURING PENCILS BROWN TUBE,PACK OF 12 COLOURED PENCILS,PACK OF 12 TRADITIONAL CRAYONS,WRAP BAD HAIR DAY,WRAP CAROUSEL,WRAP ENGLISH ROSE ,SPACEBOY GIFT WRAP,WRAP RED APPLES ,WRAP GREEN PEARS ,GINGHAM ROSE WRAP,WRAP DOILEY DESIGN,BUNDLE OF 3 RETRO NOTE BOOKS,BUNDLE OF 3 ALPHABET EXERCISE BOOKS,BUNDLE OF 3 SCHOOL EXERCISE BOOKS  ,ALARM CLOCK BAKELIKE ORANGE,BLACK BAROQUE WALL CLOCK ,BLACK BAROQUE CARRIAGE CLOCK,GRASS HOPPER WOODEN WALL CLOCK ,ALARM CLOCK BAKELIKE RED ,WORLD WAR 2 GLIDERS ASSTD DESIGNS,LUNCH BAG  BLACK SKULL.,LUNCH BAG SPACEBOY DESIGN ,LUNCH BAG SUKI DESIGN ,BAKING SET SPACEBOY DESIGN,BAKING SET 9 PIECE RETROSPOT ,AIRLINE BAG VINTAGE WORLD CHAMPION ,SKULL LUNCH BOX WITH CUTLERY ,CHILDRENS APRON SPACEBOY DESIGN,LUNCH BAG APPLE DESIGN,ABC TREASURE BOOK BOX ,BUFFALO BILL TREASURE BOOK BOX,TREASURE ISLAND BOOK BOX,GENTLEMAN SHIRT REPAIR KIT ,TRAVEL SEWING KIT,SEWING SUSAN 21 NEEDLE SET,CONDIMENT TRAY 4 BOWLS AND 4 SPOONS,SAVE THE PLANET MUG,HOME SWEET HOME MUG,PIG MUG IN TWO COLOUR DESIGNS,PACK OF 60 DINOSAUR CAKE CASES
4,BLACK TEA,COFFEE,SUGAR JARS,WHITE TEA,COFFEE,SUGAR JARS,LA PALMIERA TILE COASTER,BLUE ROUND COMPACT MIRROR,WAKE UP COCKEREL TILE COASTER,GREEN ROUND COMPACT MIRROR,SQUARE CHERRY BLOSSOM CABINET,TUMBLER BAROQUE,SCOTTIE DOGS BABY BIB,PINK/WHITE CHRISTMAS TREE 60CM,MAGNETS PACK OF 4 VINTAGE COLLAGE,MAGNETS PACK OF 4 RETRO PHOTO,MAGNETS PACK OF 4 SWALLOWS,MAGNETS PACK OF 4 VINTAGE LABELS ,MAGNETS PACK OF 4 HOME SWEET HOME,BOUDOIR SQUARE TISSUE BOX,CARAVAN SQUARE TISSUE BOX,SKULLS SQUARE TISSUE BOX,MOTORING TISSUE BOX,RED RETROSPOT TISSUE BOX,NO JUNK MAIL METAL SIGN,12 PENCILS TALL TUBE POSY,COLOURING PENCILS BROWN TUBE,HELLO SAILOR BLUE SOAP HOLDER,PURPLE PAPER PARASOL,PINK PAPER PARASOL ,RED PAPER PARASOL,YELLOW COAT RACK PARIS FASHION,BLUE COAT RACK PARIS FASHION,RED COAT RACK PARIS FASHION,METAL SIGN,CUPCAKE SINGLE HOOK,METAL SIGN CUPCAKE SINGLE HOOK,MINIATURE ANTIQUE ROSE HOOK IVORY,CHILDREN'S APRON DOLLY GIRL ,IVORY KITCHEN SCALES,MINT KITCHEN SCALES,LUNCH BAG WOODLAND,LUNCH BAG CARS BLUE,STRAWBERRY LUNCH BOX WITH CUTLERY,DOLLY GIRL LUNCH BOX,CIRCUS PARADE LUNCH BOX ,LUNCH BAG DOLLY GIRL DESIGN,LUNCH BAG ALPHABET DESIGN,LUNCH BAG VINTAGE LEAF DESIGN,REGENCY TEA PLATE ROSES ,REGENCY TEA PLATE PINK,REGENCY TEA PLATE GREEN ,DANISH ROSE DECORATIVE PLATE,REGENCY SUGAR BOWL GREEN,REGENCY MILK JUG PINK ,PINK DOUGHNUT TRINKET POT ,STRAWBERRY CERAMIC TRINKET BOX,REGENCY CAKESTAND 3 TIER,CHILDS BREAKFAST SET CIRCUS PARADE,ROSES REGENCY TEACUP AND SAUCER ,GREEN REGENCY TEACUP AND SAUCER,STRAWBERRY FAIRY CAKE TEAPOT,REGENCY TEAPOT ROSES ,PLASTERS IN TIN WOODLAND ANIMALS,PLASTERS IN TIN STRONGMAN,PLASTERS IN TIN SPACEBOY,PLASTERS IN TIN CIRCUS PARADE ,BLUE TRAVEL FIRST AID KIT,DINOSAUR KEYRINGS ASSORTED,SET OF 6 NATIVITY MAGNETS ,SET OF 5 PANCAKE DAY MAGNETS,10 COLOUR SPACEBOY PEN,SMALL YELLOW BABUSHKA NOTEBOOK ,SMALL RED BABUSHKA NOTEBOOK ,BUNDLE OF 3 SCHOOL EXERCISE BOOKS  ,BUNDLE OF 3 ALPHABET EXERCISE BOOKS,TREASURE TIN GYMKHANA DESIGN,TREASURE TIN BUFFALO BILL ,4 TRADITIONAL SPINNING TOPS,SET OF 6 SOLDIER SKITTLES,TRADITIONAL WOODEN CATCH CUP GAME ,BAG 125g SWIRLY MARBLES
5,POSTAGE
6,FLORAL FOLK STATIONERY SET,SET OF 12 MINI LOAF BAKING CASES,SET OF 12 FAIRY CAKE BAKING CASES,SET OF 6 TEA TIME BAKING CASES,SET OF 6 SNACK LOAF BAKING CASES
