,NA
1,DOORMAT HOME SWEET HOME BLUE ,DOORMAT UNION JACK GUNS AND ROSES,DOORMAT RED RETROSPOT,DOORMAT FANCY FONT HOME SWEET HOME,YOU'RE CONFUSING ME METAL SIGN ,CHOCOLATE HOT WATER BOTTLE,RETROSPOT HEART HOT WATER BOTTLE,COSY HOUR GIANT TUBE MATCHES,COSY HOUR CIGAR BOX MATCHES ,ELEPHANT CARNIVAL POUFFE,TRIANGULAR POUFFE VINTAGE ,FLOOR CUSHION ELEPHANT CARNIVAL,GINGHAM BABUSHKA DOORSTOP,OWL DOORSTOP,DOORMAT PEACE ON EARTH BLUE,DOORMAT UNION FLAG,CARRIAGE
2,HEART OF WICKER LARGE,SET 3 WICKER OVAL BASKETS W LIDS,SET 3 WICKER STORAGE BASKETS ,SWEETHEART CAKESTAND 3 TIER,SWEETHEART RECIPE BOOK STAND,SWEETHEART WIRE WALL TIDY,PHOTO FRAME CORNICE,HEART OF WICKER SMALL,TWO DOOR CURIO CABINET,ASSORTED COLOUR MINI CASES,6 ROCKET BALLOONS ,CALENDAR PAPER CUT DESIGN,ROSE COTTAGE KEEPSAKE BOX ,RETROSPOT LAMP,MEMO BOARD RETROSPOT  DESIGN,RED RETROSPOT MINI CASES,IVORY KITCHEN SCALES,BLACK KITCHEN SCALES,RECIPE BOX RETROSPOT ,LADIES & GENTLEMEN METAL SIGN,FANNY'S REST STOPMETAL SIGN,SET 12 KIDS  WHITE CHALK STICKS,12 COLOURED PARTY BALLOONS,PINK POLKADOT WRAP ,RED RETROSPOT WRAP ,WRAP ENGLISH ROSE ,GLITTER BUTTERFLY CLIPS,FAIRY CAKE FLANNEL ASSORTED COLOUR,PICTURE FRAME WOOD TRIPLE PORTRAIT,FAMILY ALBUM WHITE PICTURE FRAME
3,FELTCRAFT PRINCESS CHARLOTTE DOLL,FELTCRAFT PRINCESS OLIVIA DOLL,FELTCRAFT PRINCESS LOLA DOLL,POPPY'S PLAYHOUSE KITCHEN,POPPY'S PLAYHOUSE BATHROOM,POPPY'S PLAYHOUSE BEDROOM ,POPPY'S PLAYHOUSE LIVINGROOM ,JAM MAKING SET WITH JARS,SET OF 3 CAKE TINS PANTRY DESIGN ,RAIN PONCHO 
4,POLKADOT PEN,PHOTO CUBE,DOORMAT WELCOME TO OUR HOME,DOORMAT FANCY FONT HOME SWEET HOME,DOORMAT RESPECTABLE HOUSE,BUNNY WOODEN PAINTED WITH BIRD ,EASTER TIN CHICKS IN GARDEN,EASTER TIN BUNNY BOUQUET,EASTER TIN KEEPSAKE,SET 3 SONG BIRD PAPER EGGS ASSORTED,BOX OF 24 COCKTAIL PARASOLS,PINK HEART SHAPE EGG FRYING PAN,REGENCY CAKESTAND 3 TIER,HOME BUILDING BLOCK WORD,SET OF 2 WOODEN MARKET CRATES,RIBBON REEL HEARTS DESIGN ,SCANDINAVIAN REDS RIBBONS,6 RIBBONS RUSTIC CHARM,LOVE BUILDING BLOCK WORD,SMALL GLASS HEART TRINKET POT,ALARM CLOCK BAKELIKE RED ,HOME SWEET HOME MUG,I CAN ONLY PLEASE ONE PERSON MUG,PLEASE ONE PERSON METAL SIGN,NO SINGING METAL SIGN,CHOCOLATE THIS WAY METAL SIGN,LADIES & GENTLEMEN METAL SIGN,COOK WITH WINE METAL SIGN ,SET/2 RED RETROSPOT TEA TOWELS ,SEWING BOX RETROSPOT DESIGN ,RECIPE BOX RETROSPOT ,PACK OF 72 RETROSPOT CAKE CASES,RED RETROSPOT CAKE STAND,BIRD DECORATION RED RETROSPOT,SET 12 RETRO WHITE CHALK STICKS,SMALL POPCORN HOLDER,LUNCH BAG WOODLAND,LUNCH BAG RED RETROSPOT,FUNKY DIVA PEN
5,SET/20 RED RETROSPOT PAPER NAPKINS ,SET/5 RED RETROSPOT LID GLASS BOWLS,RED RETROSPOT ROUND CAKE TINS,RETROSPOT LARGE MILK JUG,RED RETROSPOT SMALL MILK JUG,36 FOIL HEART CAKE CASES,36 FOIL STAR CAKE CASES ,SET/6 RED SPOTTY PAPER PLATES,SET/6 RED SPOTTY PAPER CUPS,RETROSPOT SMALL TUBE MATCHES,PAPER CHAIN KIT EMPIRE,DOORMAT UNION JACK GUNS AND ROSES,DOORMAT RED RETROSPOT,JAM MAKING SET PRINTED,PACK OF 20 NAPKINS PANTRY DESIGN,PANTRY SCRUBBING BRUSH,JAM JAR WITH PINK LID,JAM JAR WITH GREEN LID,GLASS  BEURRE DISH,SET 2 PANTRY DESIGN TEA TOWELS,CANDLEHOLDER PINK HANGING HEART,RED DINER WALL CLOCK,BLUE DINER WALL CLOCK,IVORY DINER WALL CLOCK,IVORY KITCHEN SCALES,RED KITCHEN SCALES,60 TEATIME FAIRY CAKE CASES,PACK OF 60 PINK PAISLEY CAKE CASES,PACK OF 72 RETROSPOT CAKE CASES,PACK OF 60 MUSHROOM CAKE CASES,60 CAKE CASES DOLLY GIRL DESIGN,SET OF 72 PINK HEART PAPER DOILIES,SET OF 72 RETROSPOT PAPER  DOILIES,PAPER BUNTING RETROSPOT,PAPER BUNTING VINTAGE PAISLEY,PAPER CHAIN KIT RETROSPOT,SET/10 PINK POLKADOT PARTY CANDLES,SET/10 RED POLKADOT PARTY CANDLES,CREAM SWEETHEART EGG HOLDER,PLACE SETTING WHITE HEART,SET OF 4 NAPKIN CHARMS HEARTS,SET OF 4 NAPKIN CHARMS CROWNS ,SET OF 4 NAPKIN CHARMS 3 KEYS ,SET OF 4 NAPKIN CHARMS CUTLERY,SMALL HEART FLOWERS HOOK ,SOAP DISH BROCANTE,SINGLE HEART ZINC T-LIGHT HOLDER,HANGING HEART ZINC T-LIGHT HOLDER,HANGING HEART JAR T-LIGHT HOLDER,REGENCY CAKESTAND 3 TIER,PICNIC BASKET WICKER SMALL,PICNIC BASKET WICKER LARGE,DOORMAT HOME SWEET HOME BLUE ,DOORMAT WELCOME TO OUR HOME,DOORMAT ENGLISH ROSE ,EASTER CRAFT 4 CHICKS ,FELTCRAFT 6 FLOWER FRIENDS,3 STRIPEY MICE FELTCRAFT,BAKING MOULD CHOCOLATE CUPCAKES,BAKING MOULD HEART MILK CHOCOLATE,BAKING MOULD HEART WHITE CHOCOLATE,BAKING MOULD EASTER EGG WHITE CHOC,BAKING MOULD EASTER EGG MILK CHOC,RED RETROSPOT WRAP ,FANCY FONTS BIRTHDAY WRAP,WRAP, BILLBOARD FONTS DESIGN,JUMBO BAG STRAWBERRY,JUMBO BAG PINK VINTAGE PAISLEY,JUMBO BAG SCANDINAVIAN PAISLEY,SCANDINAVIAN PAISLEY PICNIC BAG,STRAWBERRY   PICNIC BAG,RED RETROSPOT PICNIC BAG,PINK VINTAGE PAISLEY PICNIC BAG,LUNCH BAG RED RETROSPOT,LUNCH BAG PINK POLKADOT,LUNCH BAG  BLACK SKULL.,BOTTLE BAG RETROSPOT ,GLITTER BUTTERFLY CLIPS,POLKADOT PEN,PINK HAPPY BIRTHDAY BUNTING,BLUE HAPPY BIRTHDAY BUNTING
6, SPACEBOY BABY GIFT SET,DOLLY GIRL BABY GIFT SET,DOORMAT WELCOME TO OUR HOME,DOORMAT WELCOME PUPPIES,DOORMAT NEW ENGLAND,DOORMAT HEARTS,DOORMAT ENGLISH ROSE ,DOORMAT HOME SWEET HOME BLUE ,CARD GINGHAM ROSE ,CARD PSYCHEDELIC APPLES,CARD BILLBOARD FONT,SPACEBOY BIRTHDAY CARD,TEA PARTY BIRTHDAY CARD,WRAP VINTAGE PETALS  DESIGN,WRAP DOILEY DESIGN,GINGHAM ROSE WRAP,WRAP ALPHABET DESIGN,WRAP RED APPLES ,WRAP, BILLBOARD FONTS DESIGN,PACK 3 BOXES BIRD PANNETONE ,PACK OF 6 BIRDY GIFT TAGS,60 CAKE CASES DOLLY GIRL DESIGN,LUNCH BAG DOLLY GIRL DESIGN,DOLLY GIRL LUNCH BOX,PACK OF 60 SPACEBOY CAKE CASES,LUNCH BAG SPACEBOY DESIGN ,SPACEBOY LUNCH BOX ,RETROSPOT TEA SET CERAMIC 11 PC ,POLKADOT PEN,RED TOADSTOOL LED NIGHT LIGHT,TOADSTOOL MONEY BOX,JUMBO BAG DOLLY GIRL DESIGN,LUNCH BAG SUKI  DESIGN ,LUNCH BAG RED RETROSPOT,LUNCH BAG PINK POLKADOT,LUNCH BAG CARS BLUE,JUMBO BAG RED RETROSPOT,SET 12 RETRO WHITE CHALK STICKS,DOORMAT RED RETROSPOT,HOME SWEET HOME METAL SIGN ,PLEASE ONE PERSON METAL SIGN,RED HANGING HEART T-LIGHT HOLDER,RED SPOT CERAMIC DRAWER KNOB,WHITE SPOT RED CERAMIC DRAWER KNOB,RED STRIPE CERAMIC DRAWER KNOB,BLUE STRIPE CERAMIC DRAWER KNOB,WHITE SPOT BLUE CERAMIC DRAWER KNOB,BLUE SPOT CERAMIC DRAWER KNOB,PINK 3 PIECE POLKADOT CUTLERY SET,BLUE 3 PIECE POLKADOT CUTLERY SET,HEART OF WICKER SMALL,HEART OF WICKER LARGE,FAMILY PHOTO FRAME CORNICE,TRIPLE PHOTO FRAME CORNICE ,PHOTO FRAME 3 CLASSIC HANGING,PHOTO FRAME CORNICE,WHITE HANGING HEART T-LIGHT HOLDER,PLACE SETTING WHITE HEART,HOME BUILDING BLOCK WORD,LOVE BUILDING BLOCK WORD,ZINC METAL HEART DECORATION,ASSORTED COLOUR BIRD ORNAMENT
7,PACK OF 20 NAPKINS RED APPLES,APRON APPLE DELIGHT,OVEN MITT APPLES DESIGN,TABLECLOTH RED APPLES DESIGN ,PEG BAG APPLES DESIGN,RECIPE BOX PANTRY YELLOW DESIGN,JAM MAKING SET WITH JARS,CARRIAGE,LUNCH BAG APPLE DESIGN
8,Manual
9,PARLOUR CERAMIC WALL HOOK,GREEN METAL BOX ARMY SUPPLIES,RED METAL BOX TOP SECRET,12 COLOURED PARTY BALLOONS,SET OF 3 NOTEBOOKS IN PARCEL,RED RETROSPOT WRAP ,BLUE POLKADOT WRAP,PINK POLKADOT WRAP ,MEMO BOARD COTTAGE DESIGN,ROSE COTTAGE KEEPSAKE BOX ,PIGGY BANK RETROSPOT ,RECIPE BOX BLUE SKETCHBOOK DESIGN,RED COAT RACK PARIS FASHION,LANTERN CREAM GAZEBO ,DOORMAT HOME SWEET HOME BLUE ,ZINC HERB GARDEN CONTAINER,SET OF 2 WOODEN MARKET CRATES,3 HOOK PHOTO SHELF ANTIQUE WHITE,SMALL PARISIENNE HEART PHOTO FRAME ,PARISIENNE KEY CABINET ,PARISIENNE CURIO CABINET,PARISIENNE SEWING BOX,PARISIENNE JEWELLERY DRAWER ,CREAM SWEETHEART MINI CHEST,LE GRAND TRAY CHIC SET,WOOD BLACK BOARD ANT WHITE FINISH,WOOD S/3 CABINET ANT WHITE FINISH,LARGE ANTIQUE WHITE PHOTO FRAME,IVORY WIRE SWEETHEART LETTER TRAY,CLASSIC METAL BIRDCAGE PLANT HOLDER,SWEETHEART RECIPE BOOK STAND,LOVE BUILDING BLOCK WORD,PICNIC BASKET WICKER LARGE
10,WRAP BILLBOARD FONTS DESIGN,REGENCY CAKESTAND 3 TIER,PACK OF 60 SPACEBOY CAKE CASES,PLACE SETTING WHITE HEART,PACK OF 60 PINK PAISLEY CAKE CASES,PACK OF 60 DINOSAUR CAKE CASES,PACK OF 72 SKULL CAKE CASES,PACK OF 72 RETROSPOT CAKE CASES,SET/20 RED RETROSPOT PAPER NAPKINS ,SMALL HEART FLOWERS HOOK ,SET/10 PINK POLKADOT PARTY CANDLES,SET/10 RED POLKADOT PARTY CANDLES,RETROSPOT SMALL TUBE MATCHES,WOODEN SCHOOL COLOURING SET,PACK OF 6 SKULL PAPER PLATES,PACK OF 6 SKULL PAPER CUPS,SET/6 RED SPOTTY PAPER PLATES,72 SWEETHEART FAIRY CAKE CASES,60 TEATIME FAIRY CAKE CASES,SET OF 72 PINK HEART PAPER DOILIES,SET OF 36 TEATIME PAPER DOILIES,PINK HAPPY BIRTHDAY BUNTING,TEA TIME PARTY BUNTING,PARTY BUNTING,JAM JAR WITH PINK LID,JAM MAKING SET PRINTED,PACK OF 20 NAPKINS PANTRY DESIGN,PAPER BUNTING RETROSPOT,PAPER BUNTING VINTAGE PAISLEY,SET OF 36 DINOSAUR PAPER DOILIES,GIN AND TONIC MUG,VINTAGE UNION JACK BUNTING,SET OF 72 RETROSPOT PAPER  DOILIES,PLASTERS IN TIN VINTAGE PAISLEY ,PLASTERS IN TIN STRONGMAN,PLASTERS IN TIN SKULLS,ZINC METAL HEART DECORATION,HANGING HEART JAR T-LIGHT HOLDER,HANGING HEART ZINC T-LIGHT HOLDER,LUNCH BAG PINK POLKADOT,LUNCH BAG  BLACK SKULL.,LUNCH BAG RED RETROSPOT,JUMBO BAG STRAWBERRY,JUMBO  BAG BAROQUE BLACK WHITE,JUMBO BAG RED RETROSPOT,JUMBO BAG PINK VINTAGE PAISLEY,JUMBO BAG SCANDINAVIAN BLUE PAISLEY,PAPER CHAIN KIT SKULLS ,JAM MAKING SET WITH JARS,MINT KITCHEN SCALES,RED KITCHEN SCALES,IVORY KITCHEN SCALES,RED RETROSPOT CAKE STAND,FELTCRAFT 6 FLOWER FRIENDS,GLITTER BUTTERFLY CLIPS,PAPER CHAIN KIT EMPIRE,ALARM CLOCK BAKELIKE IVORY,ALARM CLOCK BAKELIKE RED ,BATH BUILDING BLOCK WORD,LOVE BUILDING BLOCK WORD,HOME BUILDING BLOCK WORD,WOODEN ROUNDERS GARDEN SET ,WOODEN SKITTLES GARDEN SET,RED DINER WALL CLOCK,BLUE DINER WALL CLOCK,IVORY DINER WALL CLOCK,DOORMAT HEARTS,DOORMAT WELCOME PUPPIES,DOORMAT NEW ENGLAND,DOORMAT FAIRY CAKE,DOORMAT ENGLISH ROSE ,DOORMAT TOPIARY,DOORMAT MULTICOLOUR STRIPE,DOORMAT 3 SMILEY CATS,BREAD BIN DINER STYLE IVORY,BREAD BIN DINER STYLE RED ,DOORMAT WELCOME TO OUR HOME,DOORMAT HOME SWEET HOME BLUE ,DOORMAT UNION JACK GUNS AND ROSES,RED RETROSPOT ROUND CAKE TINS,ROSE CARAVAN DOORSTOP
11,WHITE HANGING HEART T-LIGHT HOLDER,CREAM SWEETHEART MINI CHEST,SWEETHEART RECIPE BOOK STAND,PIGGY BANK RETROSPOT ,SMALL RED RETROSPOT MUG IN BOX ,RED RETROSPOT MUG,RED RETROSPOT CAKE STAND,RED RETROSPOT BUTTER DISH,RETROSPOT LARGE MILK JUG,RED RETROSPOT SUGAR JAM BOWL,RED SPOTTY BISCUIT TIN,SET 3 RETROSPOT TEA,COFFEE,SUGAR,SET/5 RED RETROSPOT LID GLASS BOWLS
12,JUMBO  BAG BAROQUE BLACK WHITE,JUMBO BAG RED RETROSPOT,JUMBO BAG APPLES,JUMBO BAG PINK POLKADOT
13,LUNCH BAG CARS BLUE,LUNCH BAG RED RETROSPOT,LUNCH BAG SPACEBOY DESIGN ,LUNCH BAG DOLLY GIRL DESIGN,SET/20 RED RETROSPOT PAPER NAPKINS ,SET/6 RED SPOTTY PAPER PLATES,SET/6 RED SPOTTY PAPER CUPS,GLASS  SONGBIRD STORAGE JAR,DRAWER KNOB VINTAGE GLASS STAR,LARGE ANTIQUE WHITE PHOTO FRAME,JUMBO BAG VINTAGE CHRISTMAS ,JUMBO BAG 50'S CHRISTMAS ,IVORY WICKER HEART LARGE,ROLL WRAP VINTAGE SPOT ,WRAP PAISLEY PARK ,PARTY BUNTING,NATURAL SLATE HEART CHALKBOARD ,JUMBO BAG RED RETROSPOT,KEY CABINET MA CAMPAGNE,CUPBOARD 3 DRAWER MA CAMPAGNE,3 HOOK PHOTO SHELF ANTIQUE WHITE,CREAM SWEETHEART MINI CHEST,WHITE WOOD GARDEN PLANT LADDER,ZINC HEART LATTICE CHARGER LARGE,GREY HEART HOT WATER BOTTLE,FIRST AID TIN,APOTHECARY MEASURING JAR,SNOWFLAKE PORTABLE TABLE LIGHT ,ANTIQUE SILVER BAUBLE LAMP  ,PHOTO FRAME CORNICE,PICTURE FRAME WOOD TRIPLE PORTRAIT,FAMILY ALBUM WHITE PICTURE FRAME,TRIPLE PHOTO FRAME CORNICE ,FAMILY PHOTO FRAME CORNICE,PHOTO FRAME 3 CLASSIC HANGING,MIRROR CORNICE,SLATE TILE NATURAL HANGING,ALUMINIUM STAMPED HEART,HANGING ENGRAVED METAL HEART,PLASTERS IN TIN VINTAGE PAISLEY ,FAIRY TALE COTTAGE NIGHTLIGHT,TRAY, BREAKFAST IN BED,SWEETHEART WIRE WALL TIDY,IVORY WIRE KITCHEN ORGANISER,SET OF 2 CERAMIC PAINTED HEARTS ,JUMBO BAG APPLES,LUNCH BAG VINTAGE DOILY ,JUMBO BAG VINTAGE DOILY ,JUMBO BAG ALPHABET,LUNCH BAG APPLE DESIGN,LUNCH BAG ALPHABET DESIGN,LUNCH BAG VINTAGE LEAF DESIGN,RED METAL BOX TOP SECRET,SET OF 60 PANTRY DESIGN CAKE CASES ,JUMBO BAG VINTAGE LEAF
14,CARD DOLLY GIRL ,KIDS CUTLERY DOLLY GIRL ,KIDS CUTLERY SPACEBOY ,RED METAL BOX TOP SECRET,GREEN METAL BOX TOP SECRET,CORDIAL JUG,SET OF 4 KNICK KNACK TINS DOILEY ,DOILEY BISCUIT TIN,DOORKNOB CRACKED GLAZE IVORY,DOORKNOB CRACKED GLAZE IVORY,LARGE ANTIQUE WHITE PHOTO FRAME
15,PACK OF 6 SKULL PAPER PLATES,PACK OF 20 SKULL PAPER NAPKINS,PACK OF 6 SKULL PAPER CUPS,SET/6 RED SPOTTY PAPER PLATES,PARTY BUNTING,60 CAKE CASES DOLLY GIRL DESIGN,PLACE SETTING WHITE HEART,PACK OF 12 SKULL TISSUES,RETROSPOT SMALL TUBE MATCHES,PAPER CHAIN KIT SKULLS ,SET/6 RED SPOTTY PAPER CUPS,PANTRY SCRUBBING BRUSH,JAM JAR WITH GREEN LID,PACK OF 20 NAPKINS PANTRY DESIGN,REGENCY CAKESTAND 3 TIER,SET OF 36 MUSHROOM PAPER DOILIES,SET/20 RED RETROSPOT PAPER NAPKINS ,ZINC METAL HEART DECORATION,GLITTER BUTTERFLY CLIPS,HANGING HEART JAR T-LIGHT HOLDER,HANGING HEART ZINC T-LIGHT HOLDER,SINGLE HEART ZINC T-LIGHT HOLDER,LUNCH BAG PINK POLKADOT,LUNCH BAG  BLACK SKULL.,LUNCH BAG RED RETROSPOT,JUMBO BAG STRAWBERRY,JUMBO BAG RED RETROSPOT,JUMBO BAG PINK VINTAGE PAISLEY,JUMBO BAG SCANDINAVIAN BLUE PAISLEY,BAKING MOULD HEART MILK CHOCOLATE,PAPER BUNTING RETROSPOT,VINTAGE UNION JACK BUNTING,RED RETROSPOT SMALL MILK JUG,SET/5 RED RETROSPOT LID GLASS BOWLS,BOTTLE BAG RETROSPOT ,PAPER CHAIN KIT RETROSPOT,RED RETROSPOT PICNIC BAG,PINK VINTAGE PAISLEY PICNIC BAG,SCANDINAVIAN PAISLEY PICNIC BAG,DOORMAT HEARTS,DOORMAT WELCOME PUPPIES,DOORMAT NEW ENGLAND,DOORMAT FAIRY CAKE,DOORMAT ENGLISH ROSE ,DOORMAT TOPIARY,DOORMAT 3 SMILEY CATS,DOORMAT WELCOME TO OUR HOME,IVORY KITCHEN SCALES,DOORMAT UNION JACK GUNS AND ROSES,DOORMAT RED RETROSPOT,BLUE HAPPY BIRTHDAY BUNTING,RETROSPOT LARGE MILK JUG,WOODEN ROUNDERS GARDEN SET ,WOODEN SKITTLES GARDEN SET,BLUE DINER WALL CLOCK,DOORMAT HOME SWEET HOME BLUE ,ROSE CARAVAN DOORSTOP
16,PARISIENNE JEWELLERY DRAWER ,PARISIENNE SEWING BOX,PARISIENNE KEY CABINET ,PARISIENNE CURIO CABINET,GLASS BON BON JAR,SET OF 4 KNICK KNACK TINS DOILEY ,RED METAL BOX TOP SECRET,FOLDING MIRROR HOT PINK ,LADIES & GENTLEMEN METAL SIGN,ALARM CLOCK BAKELIKE RED ,RECIPE BOX RETROSPOT ,SET OF 2 WOODEN MARKET CRATES,SMALL POPCORN HOLDER,FUNKY DIVA PEN,6 RIBBONS RUSTIC CHARM,PLEASE ONE PERSON METAL SIGN,COOK WITH WINE METAL SIGN ,RIBBON REEL CHRISTMAS SOCK BAUBLE,RIBBON REEL SNOWY VILLAGE,SET OF 6 RIBBONS VINTAGE CHRISTMAS,BOX OF 24 COCKTAIL PARASOLS,REGENCY CAKESTAND 3 TIER,HOME BUILDING BLOCK WORD,LOVE BUILDING BLOCK WORD,SMALL GLASS HEART TRINKET POT,HOME SWEET HOME MUG,PACK OF 72 RETROSPOT CAKE CASES,RED RETROSPOT CAKE STAND,LUNCH BAG RED RETROSPOT,DOORMAT FANCY FONT HOME SWEET HOME,SET/4 SKULL BADGES,TREASURE TIN BUFFALO BILL ,TREASURE TIN GYMKHANA DESIGN,MEMO BOARD RETROSPOT  DESIGN,ROUND SNACK BOXES SET OF 4 SKULLS,ROUND SNACK BOXES SET OF4 WOODLAND ,LUNCH BAG VINTAGE DOILY ,LUNCH BAG PINK POLKADOT,LUNCH BAG  BLACK SKULL.,LUNCH BAG SPACEBOY DESIGN ,METAL SIGN DROP YOUR PANTS,MINI PAINT SET VINTAGE ,VINTAGE CHRISTMAS BUNTING,SET OF 2 CERAMIC CHRISTMAS REINDEER,CHRISTMAS RETROSPOT ANGEL WOOD,CHRISTMAS TOILET ROLL,CHRISTMAS CRAFT LITTLE FRIENDS,60 CAKE CASES VINTAGE CHRISTMAS
17,SCANDINAVIAN 3 HEARTS NAPKIN RING,SET OF 20 VINTAGE CHRISTMAS NAPKINS,36 DOILIES VINTAGE CHRISTMAS,SET OF 4 SANTA PLACE SETTINGS,PAPER CHAIN KIT 50'S CHRISTMAS ,VINTAGE CHRISTMAS BUNTING,VINTAGE CHRISTMAS STOCKING ,ZINC FOLKART SLEIGH BELLS,SET OF 3 WOODEN SLEIGH DECORATIONS,SET OF 3 WOODEN TREE DECORATIONS,SET OF 3 WOODEN HEART DECORATIONS,SET OF 3 WOODEN STOCKING DECORATION,HOT WATER BOTTLE KEEP CALM,KNITTED UNION FLAG HOT WATER BOTTLE,GREEN GOOSE FEATHER CHRISTMAS TREE ,MOCK LOBSTER FRIDGE MAGNET,CHRISTMAS CRAFT TREE TOP ANGEL
18,JUMBO BAG VINTAGE CHRISTMAS ,ZINC T-LIGHT HOLDER STARS SMALL,HANGING HEART ZINC T-LIGHT HOLDER,ZINC T-LIGHT HOLDER STAR LARGE,CHRISTMAS TABLE SILVER CANDLE SPIKE,JUMBO BAG 50'S CHRISTMAS ,HANGING CLEAR MINI BOTTLE,FOOT STOOL HOME SWEET HOME ,HOME SWEET HOME CUSHION COVER ,BELLE JARDINIERE CUSHION COVER,LA JARDIN BOTANIQUE CUSHION COVER,DRAWER KNOB VINTAGE GLASS STAR,DRAWER KNOB CERAMIC IVORY,WHITE SPOT BLUE CERAMIC DRAWER KNOB,BLUE SPOT CERAMIC DRAWER KNOB,BLUE DRAWER KNOB ACRYLIC EDWARDIAN,CLEAR DRAWER KNOB ACRYLIC EDWARDIAN,RED DRAWER KNOB ACRYLIC EDWARDIAN,PURPLE DRAWERKNOB ACRYLIC EDWARDIAN,GLASS HEART T-LIGHT HOLDER ,SET OF 6 SPICE TINS PANTRY DESIGN,GINGERBREAD MAN COOKIE CUTTER,SET OF 60 PANTRY DESIGN CAKE CASES ,EGG FRYING PAN MINT ,EGG FRYING PAN IVORY ,EGG FRYING PAN PINK ,SET 36 COLOURING PENCILS DOILY,ALARM CLOCK BAKELIKE PINK,PINK DINER WALL CLOCK,FELTCRAFT CHRISTMAS FAIRY,3 STRIPEY MICE FELTCRAFT,JUMBO BAG VINTAGE DOILY ,JUMBO BAG PINK VINTAGE PAISLEY,JUMBO BAG SCANDINAVIAN BLUE PAISLEY,JUMBO BAG VINTAGE LEAF,JUMBO BAG ALPHABET,JUMBO BAG APPLES,JUMBO BAG PEARS,GARDENERS KNEELING PAD KEEP CALM ,GARDENERS KNEELING PAD CUP OF TEA ,HANGING MINI COLOURED BOTTLES,HANGING JAM JAR T-LIGHT HOLDERS,HOT WATER BOTTLE TEA AND SYMPATHY,ENGLISH ROSE HOT WATER BOTTLE,LOVE HOT WATER BOTTLE,HOT WATER BOTTLE I AM SO POORLY,HAND WARMER OWL DESIGN,HAND WARMER SCOTTY DOG DESIGN,HAND WARMER RED LOVE HEART,DOG LICENCE WALL ART,DOORMAT KEEP CALM AND COME IN,DOORMAT VINTAGE LEAF,DOORMAT HOME SWEET HOME BLUE ,BICYCLE SAFTEY WALL ART,VILLAGE SHOW WALL ART,STOP FOR TEA WALL ART,WRAP  VINTAGE DOILY ,DOORMAT PEACE ON EARTH BLUE,WRAP RED VINTAGE DOILY,WRAP VINTAGE LEAF DESIGN,WRAP BIRD GARDEN ,WRAP ALPHABET DESIGN
19,DOORMAT MULTICOLOUR STRIPE
20,PAPER CHAIN KIT 50'S CHRISTMAS ,PAPER CHAIN KIT VINTAGE CHRISTMAS,CHRISTMAS METAL TAGS ASSORTED ,MISELTOE HEART WREATH WHITE,CHRISTMAS LIGHTS 10 REINDEER,HEART SHAPED HOLLY WREATH,MISELTOE HEART WREATH ,60 CAKE CASES VINTAGE CHRISTMAS,SET OF 6 NATIVITY MAGNETS ,RIBBON REEL SNOWY VILLAGE,SET OF 20 VINTAGE CHRISTMAS NAPKINS,BISCUIT TIN VINTAGE CHRISTMAS,36 DOILIES VINTAGE CHRISTMAS,VICTORIAN GLASS HANGING T-LIGHT,HEART T-LIGHT HOLDER WILLIE WINKIE,STAR T-LIGHT HOLDER WILLIE WINKIE,REINDEER HEART DECORATION SILVER,CHERUB HEART DECORATION SILVER 
21,FELTCRAFT CHRISTMAS FAIRY,FELTCRAFT BUTTERFLY HEARTS,FELTCRAFT BOY JEAN-PAUL KIT,CHRISTMAS CRAFT WHITE FAIRY ,CHRISTMAS CRAFT TREE TOP ANGEL,CHRISTMAS CRAFT LITTLE FRIENDS,3 STRIPEY MICE FELTCRAFT,RED FLORAL FELTCRAFT SHOULDER BAG,PINK FLORAL FELTCRAFT SHOULDER BAG,PINK CREAM FELT CRAFT TRINKET BOX ,PINK BLUE FELT CRAFT TRINKET BOX,FELTCRAFT PRINCESS OLIVIA DOLL,FELTCRAFT PRINCESS LOLA DOLL,FELTCRAFT PRINCESS CHARLOTTE DOLL,FELTCRAFT GIRL NICOLE KIT,FELTCRAFT GIRL AMELIE KIT,FELTCRAFT DOLL ROSIE,FELTCRAFT DOLL MOLLY,FELTCRAFT DOLL EMILY,FELTCRAFT CUSHION OWL
22,WHITE HANGING HEART T-LIGHT HOLDER
23,SET OF 72 RETROSPOT PAPER  DOILIES,SET/20 RED RETROSPOT PAPER NAPKINS ,PLASTERS IN TIN VINTAGE PAISLEY ,PLASTERS IN TIN STRONGMAN,PLASTERS IN TIN SKULLS,ZINC METAL HEART DECORATION,GLITTER BUTTERFLY CLIPS,WHITE HANGING HEART T-LIGHT HOLDER,HANGING HEART JAR T-LIGHT HOLDER,PACK OF 6 BIRDY GIFT TAGS,PAPER CHAIN KIT RETROSPOT,JUMBO BAG STRAWBERRY,JUMBO  BAG BAROQUE BLACK WHITE,JUMBO BAG RED RETROSPOT,JUMBO STORAGE BAG SKULLS,JUMBO BAG OWLS,EGG FRYING PAN MINT ,EGG FRYING PAN PINK ,EGG FRYING PAN IVORY ,36 FOIL HEART CAKE CASES,SET/5 RED RETROSPOT LID GLASS BOWLS,BATH BUILDING BLOCK WORD,LOVE BUILDING BLOCK WORD,HOME BUILDING BLOCK WORD,BELLE JARDINIERE CUSHION COVER,DOORMAT KEEP CALM AND COME IN,DOORMAT RED RETROSPOT,LOVE HOT WATER BOTTLE,HOT WATER BOTTLE TEA AND SYMPATHY,WALL ART STOP FOR TEA ,WOODEN ROUNDERS GARDEN SET ,DOORMAT HEARTS,DOORMAT WELCOME PUPPIES,DOORMAT NEW ENGLAND,DOORMAT FAIRY CAKE,DOORMAT ENGLISH ROSE ,DOORMAT VINTAGE LEAF,MINT KITCHEN SCALES,RED KITCHEN SCALES,IVORY KITCHEN SCALES,DOORMAT SPOTTY HOME SWEET HOME,DOORMAT FANCY FONT HOME SWEET HOME,RED RETROSPOT ROUND CAKE TINS,BREAD BIN DINER STYLE RED ,CLEAR DRAWER KNOB ACRYLIC EDWARDIAN,72 SWEETHEART FAIRY CAKE CASES,60 TEATIME FAIRY CAKE CASES,PACK OF 60 SPACEBOY CAKE CASES,PACK OF 60 DINOSAUR CAKE CASES,PACK OF 72 SKULL CAKE CASES,PACK OF 72 RETROSPOT CAKE CASES,SMALL HEART FLOWERS HOOK ,SLATE TILE NATURAL HANGING,SINGLE HEART ZINC T-LIGHT HOLDER,WOODEN SCHOOL COLOURING SET,SET OF 72 PINK HEART PAPER DOILIES,SET OF 36 TEATIME PAPER DOILIES,JAM JAR WITH PINK LID,JAM MAKING SET PRINTED,SET OF 36 SPACEBOY PAPER DOILIES,SET OF 36 DINOSAUR PAPER DOILIES
24,ANTIQUE HEART SHELF UNIT,VINTAGE DOILY JUMBO BAG RED ,JUMBO BAG PAISLEY PARK
25,ZINC FOLKART SLEIGH BELLS,SET OF 3 WOODEN HEART DECORATIONS,SET OF 3 WOODEN SLEIGH DECORATIONS,SET OF 3 WOODEN TREE DECORATIONS,SET OF 3 WOODEN STOCKING DECORATION,VINTAGE CHRISTMAS BUNTING,KNITTED UNION FLAG HOT WATER BOTTLE,HOT WATER BOTTLE KEEP CALM,CARRIAGE
26,PAPER CHAIN KIT 50'S CHRISTMAS ,PAPER CHAIN KIT VINTAGE CHRISTMAS,VINTAGE UNION JACK BUNTING,PLAYING CARDS KEEP CALM & CARRY ON,HOT WATER BOTTLE KEEP CALM
27,FAMILY ALBUM WHITE PICTURE FRAME,PICTURE FRAME WOOD TRIPLE PORTRAIT
28,Manual
29,PIGGY BANK RETROSPOT ,LARGE ANTIQUE WHITE PHOTO FRAME
30,SET 3 RETROSPOT TEA,COFFEE,SUGAR
31,SMALL GLASS HEART TRINKET POT
32,SET/5 RED RETROSPOT LID GLASS BOWLS,ANTIQUE HEART SHELF UNIT
33,RETROSPOT LARGE MILK JUG
